{
    "fleet": "Scourge",
    "class": "Solar Wyvern",
    "type": "Cruiser",
    "rule_name": "Counts As",
    "rule_text": "This ship counts as a Wyvern Cruiser.",
    "known_ships": [],
    "flavour": "",
    "counts_as_class": "Wyvern",
    "counts_as_type": "Cruiser",
    "availability": "RESIN"
}